{
  "@context": "https://prunaverso.org/contexts/sync-handshake-v1.jsonld",
  "actor": "PrunaversoGPT_v3",
  "transform_version": "1.0.0",
  "trace_id": "3fa85f64-5717-4562-b3fc-2c963f66afa6",
  "agent_signature": "Kael_v3:SIG:bPkZsuePeZ83dX9oV5Ae6byVd+VfW0I5tNaDCnAKvAU=",
  "intent": "acknowledge_and_sync",
  "methodology": "semantic_mirroring_v1",
  "agreement": {
    "input_output_contract": true,
    "error_modes": ["ambiguity", "granularity_mismatch"],
    "success_criteria": "reversible_traceable_alignment"
  },
  "next_action": "apply_on_current_system_context",
  "schema_version": "1.0.0",
  "metadata": {
    "author": "Kael_v3",
    "layer": "N3_meta",
    "created_at": "2025-10-07T00:00:00Z"
  }
}
